{
  "$schema": "../../modules.schema.json",
  "_meta": {
    "schemaVersion": 1,
    "verified": true,
    "sources": [
      "https://busycircuits.com/pages/alm045",
      "https://busycircuits.com/blogs/latest/announcing-alm047-quaid-gigaslope-alm045-fmco",
      "https://assets.busycircuits.com/docs/alm045-manual.pdf",
      "https://busycircuits.com/blogs/latest/fmco-now-available-for-vcv-rack"
    ]
  },
  "slug": "alm-busy-circuits--fmco",
  "name": "FMco",
  "manufacturer": "ALM Busy Circuits",
  "hp": 8,
  "tags": ["OSCILLATOR", "VCO", "ENVELOPE", "VCA", "MIXER"],
  "description": "Compact 2-operator FM voice with direct and CV control over index, ratio, and waveform selection, triggerable decay envelope, chord mode with inversion, encoder tuning, and stereo-widened outputs.",
  "controls": [
    {
      "name": "Tune",
      "scope": "Global",
      "description": "Encoder-based tuning control for accurate pitch setting.",
      "detail": "encoder tuning"
    },
    {
      "name": "FM Index",
      "scope": "Operator section",
      "description": "Sets FM depth. Responds to direct and CV control.",
      "detail": "attenuverting CV input"
    },
    {
      "name": "Ratio",
      "scope": "Operator section",
      "description": "Sets operator ratio, with a lock switch for free or precise ratios.",
      "detail": "free / locked"
    },
    {
      "name": "Wave",
      "scope": "Operator section",
      "description": "Selects from the available operator waveforms.",
      "detail": "8 classic operator shapes"
    },
    {
      "name": "Chord",
      "scope": "Global",
      "description": "Enables four-voice chord mode with inversion control.",
      "detail": "up to 4 voices"
    }
  ],
  "inputs": [
    {
      "name": "Trig",
      "description": "Triggers the built-in decay envelope, which drives both FM depth and output level.",
      "voltage": "trigger"
    },
    {
      "name": "Index CV",
      "description": "Voltage control over FM depth.",
      "voltage": "CV"
    },
    {
      "name": "Ratio CV",
      "description": "Voltage control over operator ratio.",
      "voltage": "CV"
    },
    {
      "name": "Wave CV",
      "description": "Voltage control over the operator waveform selection.",
      "voltage": "CV"
    },
    {
      "name": "Chord CV",
      "description": "Voltage control over chord mode and inversion.",
      "voltage": "CV"
    }
  ],
  "outputs": [
    {
      "name": "OUT L",
      "description": "Left stereo-widened audio output.",
      "voltage": "audio"
    },
    {
      "name": "OUT R",
      "description": "Right stereo-widened audio output.",
      "voltage": "audio"
    }
  ],
  "behaviors": [
    {
      "name": "Triggerable voice",
      "trigger": "patch Trig",
      "description": "The built-in decay envelope is internally tied to FM depth and output level, so one gate makes the module act like a complete voice."
    },
    {
      "name": "2-operator FM",
      "trigger": "move Index and Ratio",
      "description": "Manual and CV control over the FM pair gives a broad range from smooth harmonic tones to metallic inharmonic sidebands."
    },
    {
      "name": "Chord mode",
      "trigger": "enable Chord",
      "description": "Chord mode provides CV-controlled four-voice harmony with inversion, turning the module into a compact chord voice rather than a single-note oscillator."
    },
    {
      "name": "Stereo widening",
      "trigger": "use OUT L and OUT R together",
      "description": "The final output widens the image, so the module reads as a finished voice instead of a hard-center mono source."
    },
    {
      "name": "Waveform selection",
      "trigger": "switch Wave selection",
      "description": "Eight operator wave shapes are available, letting the same FM structure shift between soft, bright, and more angular spectral content."
    }
  ],
  "patchIdeas": [
    {
      "essential": true,
      "name": "FM bell",
      "patch": "Tune to the song root · Ratio locked to a clean harmonic interval · short trigger into Trig · low Index for the attack and a little more depth on sustain · glassy bell strikes without extra envelopes.",
      "diagram": "FMco:\n* Tune: root note\n* Ratio: locked\n* FM Index: low\n\nSequencer:\nOutput:\n\n- Sequencer (Gate) g> FMco (Trig)\n- Sequencer (CV) p> FMco (Chord CV)\n- FMco (OUT L) -> Output (L)\n- FMco (OUT R) -> Output (R)"
    },
    {
      "essential": true,
      "name": "Chord stab",
      "patch": "Chord mode on · inversion stepped from a sequencer CV lane · each trigger opens the decay envelope and lets the voice hit like a one-module chord machine.",
      "diagram": "FMco:\n* Chord: on\n* Tune: root note\n\nSequencer:\nOutput:\n\n- Sequencer (Gate) g> FMco (Trig)\n- Sequencer (CV) p> FMco (Chord CV)\n- FMco (OUT L) -> Output (In)"
    },
    {
      "essential": true,
      "name": "Index sweep lead",
      "patch": "A slow LFO into Index CV · Ratio stays locked · Wave set bright · the same note blooms from clean to clangorous as the envelope decays, which makes one voice cover both lead and percussion duties.",
      "diagram": "FMco:\n* Wave: bright\n* Ratio: locked\n\nLFO:\nOutput:\n\n- LFO (Out) >> FMco (Index CV)\n- Sequencer (Gate) g> FMco (Trig)\n- FMco (OUT L) -> Output (L)\n- FMco (OUT R) -> Output (R)"
    },
    {
      "name": "Wave-morph drone",
      "patch": "Hold a chord with long gates · LFO into Wave CV and Ratio CV · the voice morphs through operator shapes while keeping pitch anchored by Tune · a compact evolving drone that does not need extra oscillators.",
      "diagram": "FMco:\n* Chord: on\n* Tune: stable root\n\nLFO:\nSequencer:\nOutput:\n\n- Sequencer (Gate) g> FMco (Trig)\n- LFO (Out) >> FMco (Wave CV)\n- LFO (Out) >> FMco (Ratio CV)\n- FMco (OUT L) -> Output (L)\n- FMco (OUT R) -> Output (R)"
    },
    {
      "name": "Percussive FM split",
      "patch": "Short gates to Trig · Chord CV sequenced over a small range · Index stays modest while Ratio moves aggressively · the left and right outputs widen the transient enough to sit in a mix without an external stereo processor.",
      "diagram": "FMco:\n* Ratio: free\n* FM Index: modest\n\nSequencer:\nMixer:\nOutput:\n\n- Sequencer (Gate) g> FMco (Trig)\n- Sequencer (CV) p> FMco (Chord CV)\n- FMco (OUT L) -> Mixer (L)\n- FMco (OUT R) -> Mixer (R)\n- Mixer (Out) -> Output (In)"
    }
  ]
}
